{
  "$schema": "../schema/research-graph-v1.schema.json",
  "schema_version": "research-graph/v1",
  "graph_id": "research-graph:hypercomplex",
  "title": "ICE hypercomplex hypothesis-testbench research graph",
  "description": "A repository-local memory and index graph for the finite Cayley-Dickson and sedenion calculations. It separates computed algebraic facts, interpretation, invalid or superseded methods, and open physical hypotheses without promoting the corpus to a Standard Model embedding or TOE.",
  "updated_at_utc": "2026-09-03T12:00:00Z",
  "canonical_file": "ontology/hypercomplex/graph.json",
  "source_inventory": "ontology/hypercomplex/references/source-inventory.md",
  "quick_answers": [
    {
      "question": "What does the robust number 42 count?",
      "answer": "The direct calculation distinguishes 42 unordered assessor axis-planes (seven classes of six), 84 signed vectors e_a +/- e_b with a<b, and 168 representations when both index orders are counted. Annihilating-pair totals need their own sign and ordering convention; none of these counts establishes 42 Higgs particles.",
      "claim_ids": [
        "claim:HYPER_ZD_ASSESSOR_ORBIT_CHAIN",
        "claim:HYPER_ALGEBRA_ESTABLISHES_SM_REFERENTS"
      ]
    },
    {
      "question": "Did the projected custodial SU(2) x SU(2) construction close?",
      "answer": "No. All 42 frozen candidates fail both projected closure conditions; the later portability audit also finds combined rank three rather than the required rank six.",
      "claim_ids": [
        "claim:HYPER_PROJECTED_CUSTODIAL_SU2XSU2"
      ]
    },
    {
      "question": "Can Queue 03 be used as portable threshold evidence?",
      "answer": "No. Its entrywise commutator maximum changes under an orthogonal change of null-space basis, so its threshold categories are quarantined as NONPORTABLE_FAIL and provide no new physics verdict.",
      "claim_ids": [
        "claim:HYPER_QUEUE03_PORTABLE_THRESHOLD_EVIDENCE"
      ]
    },
    {
      "question": "Was a g2 representation established by the projected sedenion construction?",
      "answer": "No. The original projection is a method artifact. A later sidecar recovers rank 14 and antisymmetry, but its declared full Lie-closure and Casimir validation is contradicted by the recorded controls.",
      "claim_ids": [
        "claim:HYPER_PROJECTED_SEDENION_G2_REPRESENTATION",
        "claim:HYPER_AUTO_EMBEDDED_G2_RANK14_ANTISYMMETRY",
        "claim:HYPER_AUTO_EMBEDDED_G2_FULL_VALIDATION"
      ]
    },
    {
      "question": "Was an explicit S3 automorphism subgroup computed?",
      "answer": "Yes within the declared Cayley-Dickson convention: the two generators preserve all tested products, satisfy the S3 presentation, and generate a group of order six. A later finite action audit finds that the two generators centralize the computed 14-dimensional derivation space, and a separate two-convention audit finds that they preserve the transcribed Wilmot eq-9 theta tensor. These results do not prove the full global automorphism-group decomposition. The older claim that this refuted Wilmot was withdrawn.",
      "claim_ids": [
        "claim:HYPER_EXPLICIT_S3_AUTOMORPHISM_SUBGROUP",
        "claim:HYPER_S3_ACTION_CENTRALIZES_COMPUTED_DERIVATION_SPACE",
        "claim:HYPER_RECORDED_S3_PRESERVES_WILMOT_EQ9_THETA",
        "claim:HYPER_DIRECT_ACTION_TEST_PROVES_FULL_AUT_S_DECOMPOSITION",
        "claim:HYPER_QUEUE09_REFUTES_WILMOT"
      ]
    },
    {
      "question": "Did the sealed Claim B calculations support a stable infinite Cayley-Dickson tower limit?",
      "answer": "No under their preregistered finite-level criteria. The n=5..7 nullity distributions remain far apart, the n=4..7 associator distributions reconfigure, and the recorded prediction family fails its declared Cauchy-decreasing predicate. This kills that finite statistical route; it neither constructs nor universally disproves an infinite-dimensional path integral or a gravity map.",
      "claim_ids": [
        "claim:HYPER_CLAIMB_NULLITY_DISTRIBUTION_STABILIZES_N5_N7",
        "claim:HYPER_CLAIMB_ASSOCIATOR_DISTRIBUTION_STABILIZES_N4_N7",
        "claim:HYPER_CLAIMB_PREDICTION_FAMILY_IS_CAUCHY_DECREASING_N5_N7",
        "claim:HYPER_CLAIMB_FINITE_LOOP_ESTABLISHES_INFINITE_TOWER_GRAVITY"
      ]
    }
  ],
  "reading_paths": [
    {
      "id": "reading-path:hyper-zd-structure",
      "title": "From multiplication to the finite zero-divisor structure",
      "summary": "Start with the fixed multiplication convention, distinguish assessor planes, signed vectors, index-ordered representations, and annihilating pairs, and then read the seven-by-six and XOR regularities without adding a particle referent.",
      "nodes": [
        "concept:cayley-dickson-multiplication-convention",
        "concept:sedenion-assessor-nullspace-orbit",
        "claim:HYPER_ZD_ASSESSOR_ORBIT_CHAIN",
        "claim:HYPER_XOR_ORBIT_LABEL",
        "evidence:hyper-finite-structural-ledger"
      ]
    },
    {
      "id": "reading-path:hyper-higher-algebra",
      "title": "Finite associator and higher-algebra witnesses",
      "summary": "Follow the recorded Jacobiator, associator, Stasheff, and BV checks while keeping their finite-array scope explicit.",
      "nodes": [
        "concept:cayley-dickson-multiplication-convention",
        "claim:HYPER_FINITE_HIGHER_ALGEBRA_IDENTITIES",
        "evidence:hyper-finite-structural-ledger",
        "scope:hypercomplex-workbench-layer-boundary"
      ]
    },
    {
      "id": "reading-path:hyper-projection-failure",
      "title": "Where projection loses closure and portability",
      "summary": "Move from four-dimensional null spaces to the frozen projected triples, their 42-of-42 closure failure, and the basis-dependent Queue-03 metric quarantine.",
      "nodes": [
        "concept:sedenion-assessor-nullspace-orbit",
        "concept:projected-versus-ambient-symmetry",
        "claim:HYPER_PROJECTED_CUSTODIAL_SU2XSU2",
        "claim:HYPER_QUEUE03_PORTABLE_THRESHOLD_EVIDENCE",
        "evidence:hyper-projection-and-portability-ledger",
        "open:hyper-basis-invariant-projected-diagnostic"
      ]
    },
    {
      "id": "reading-path:hyper-g2-lifecycle",
      "title": "Projected g2 claim and partial repair",
      "summary": "Contrast the rank-16 projected method artifact with the later rank-14 sidecar and its still-failed full validation controls.",
      "nodes": [
        "concept:projected-versus-ambient-symmetry",
        "claim:HYPER_PROJECTED_SEDENION_G2_REPRESENTATION",
        "claim:HYPER_AUTO_EMBEDDED_G2_RANK14_ANTISYMMETRY",
        "claim:HYPER_AUTO_EMBEDDED_G2_FULL_VALIDATION",
        "evidence:hyper-toy-and-g2-lifecycle",
        "open:hyper-result-producer-and-interpretation-provenance"
      ]
    },
    {
      "id": "reading-path:hyper-s3-interpretation",
      "title": "The S3 subgroup, derivation action, theta test, and interpretation boundary",
      "summary": "Keep the multiplication/group gates, the computed trivial action on the 14-dimensional derivation space, and theta preservation in the two recorded conventions while following the correction that withdrew the Wilmot-refutation language. Stop before a full Aut(S) classification or particle-generation inference.",
      "nodes": [
        "claim:HYPER_EXPLICIT_S3_AUTOMORPHISM_SUBGROUP",
        "claim:HYPER_S3_ACTION_CENTRALIZES_COMPUTED_DERIVATION_SPACE",
        "evidence:hyper-s3-direct-action-ledger",
        "claim:HYPER_RECORDED_S3_PRESERVES_WILMOT_EQ9_THETA",
        "evidence:hyper-wilmot-theta-lifecycle",
        "claim:HYPER_DIRECT_ACTION_TEST_PROVES_FULL_AUT_S_DECOMPOSITION",
        "claim:HYPER_QUEUE09_REFUTES_WILMOT",
        "evidence:hyper-s3-three-gate-lifecycle",
        "claim:HYPER_ALGEBRA_ESTABLISHES_SM_REFERENTS",
        "open:hyper-algebra-to-physics-discriminator"
      ]
    },
    {
      "id": "reading-path:hyper-claimb-sealed-finite-route",
      "title": "The sealed finite-level Claim B route and its remaining boundary",
      "summary": "Start with the distinction between a finite sedenion truncation and an infinite Cayley-Dickson tower, inspect the three preregistered finite-level non-stability results, and stop before treating them as a constructed infinite-dimensional measure, gravity map, or universal no-go.",
      "nodes": [
        "concept:infinite-cd-tower-truncation-stability",
        "scope:hyper-claimb-n4-n7-sealed-loop",
        "claim:HYPER_CLAIMB_NULLITY_DISTRIBUTION_STABILIZES_N5_N7",
        "claim:HYPER_CLAIMB_ASSOCIATOR_DISTRIBUTION_STABILIZES_N4_N7",
        "claim:HYPER_CLAIMB_PREDICTION_FAMILY_IS_CAUCHY_DECREASING_N5_N7",
        "evidence:hyper-claimb-sealed-finite-level-ledger",
        "claim:HYPER_CLAIMB_FINITE_LOOP_ESTABLISHES_INFINITE_TOWER_GRAVITY",
        "open:hyper-infinite-tower-continuum-observable-map"
      ]
    }
  ],
  "node_type_legend": {
    "programme": "overall research question",
    "concept": "reusable definition or distinction",
    "claim": "falsifiable or scoped statement",
    "evidence": "observed calculation, diagnostic, or audit group",
    "scope": "assumptions, layer boundary, and exclusions",
    "open_problem": "missing construction or unresolved question",
    "artifact": "hash-pinned tracked repository file"
  },
  "relation_legend": {
    "PART_OF": "belongs to the hypercomplex testbench",
    "ABOUT": "claim concerns a reusable concept",
    "HAS_EVIDENCE": "claim points to supporting or contradicting evidence; see polarity",
    "DEFINED_IN": "an evidence distinction is implemented by a hash-pinned source",
    "RECORDED_IN": "evidence is persisted or explained in a tracked artifact",
    "DOCUMENTED_BY": "programme has a hash-pinned navigation or provenance record",
    "DERIVED_FROM": "evidence is separately reconstructed by a hash-pinned implementation",
    "VALID_WITHIN": "claim is limited by the declared workbench scope",